	review	pred_polarity	test_polarity	false_positives	false_negatives
1649	"i got nexplanon  on 52015
the first few months were pretty out there my mood was stupid crazy but to be honest my mood is always stupid crazy
i am one of the lucky few who dont have regular periods while on nexplanon when i used to before some times i miss months sometimes i spot a whole month as for december of 16 34 weeks i was constant bleeding it did hurt my libido in the beginning but i am now perfectly fine although the bleeding is annoying i recommend it to everyone its less terrifying than the idea of an iud and you cant forget to take it"	0	1	0	1
5039	i was previously on trisprintec for years when my pharmacy started carrying triprevifem i switched thinking it would affect me the same however i started getting headaches often feeling weak my face broke out and i had spotting i know that these effects may come when switching brands but when i switched from ortho tricyclen lo to its generic then back to brand then to trisprintec i have never had any problems i am a pharmacy technician and i have had several customers that have had trouble when switching to previfem or triprevifem i will be switching back to trisprintec once the pharmacy special orders it	0	1	0	1
4451	i switched to the nr in september of 2014 because i was constantly bleeding with my pills  i loved it i did have mood swings right before my period and possible drop in libido but im not sure if it was from the nr or due to stress  i recently have to stop nr due to it falling out i started a new ring a week ago amp could not get it to stay in place never has this happen before  i went to the doctor and they had not explaination so they started me on some pills  they said i could possibly try again in a month amp i will  nr is not cheap but the company does have a coupon you can use  if i can use it again i would	0	1	0	1
14433	very slight nausea feeling when i take it but i learned to avoid it by taking it just before i go to sleep it makes my breast swollen which looks good but feels horrible its fairly painful it causes me to sweat more then normal and causes excessive vaginal lubrication to the extreme some people my not mind but when its so noticeable you feel like you peed yourself and you no longer have friction during intercourse to the point of embarrassment  a problem ive never had  i never got pregnant so thats a plus	0	1	0	1
1280	i switched to enskyce from reclipsen for cost effectiveness and felt different almost immediately after a few weeks i noticed that my emotions were considerably more inconsistent small things that wouldnt normally bother me started to make me extremely upset and although i realized that i shouldnt have been upset at the time i felt like i couldnt pull myself out of being emotional i didnt pay any mind to it because i thought some outside things couldve been stressing me out but it got to the point where id be having emotional breakdowns almost weekly and about normally insignificant things periods were thicker and more painful effective as a contraceptive but the side effects were a dealbreaker for me	0	1	0	1
8687	i have been on loryna for 6 years now i also have been on birth control since i was 17 and now 26 with no breaks i have no periods ever or spotting my face is clear normally no weight gain at all i lose weight more than gain i have read mixed reviews about this birth control it can be good or bad i have had no problems with the pill unless i forget to take it one day then i may breakout with pimples  i enjoy this birth control due to no problems i recommend trying it if it does not work get off of it most birth controls are not good for you anyways its not healthy but being a woman we all need it for many different reasons	0	1	0	1
14697	ive been using this product for almost 3 months im still having the side effects of starting this new method but i have lost 5 pounds since i started using ortho evra my only problem is i cant tan my doctor did not tell me i wasnt supposed to get a tan well when i got out i had the worst mood swings ever also i wake up every hour of the night throwing up from 39 in the morning its absolutely horrible because vomiting is one of my main fears other than that i do love this product and i am disappointed that i have to switch to ortho tricyclen because tanning is more important to me right now	0	1	0	1
11145	i began taking this medicine for birth control it was effective for that purpose but i kept having repeat yeast infections amp bacterial vaginitis i will most definitely stop this medicine when im done with this pack of pills everyones body is different though	0	1	0	1
14634	"before trying this type of birth control i read the reviews here and i thought there was a great chance that i wouldnt have any serious side effects although i didnt have serious side effects i did experience spotting every single day while on this my periods were heavier than usual i was moodier i had a great increase in appetite which made me feel like a pregnant woman because i was bleeding every day i never wanted to have sex this product definitely did what it was supposed to for me the one pro was that i only had to change my patch once a week 

i will be switching back to the pill with the birthcontrol pill i never experienced any negative side effects my only problem was forgetting to take it"	0	1	0	1
12608	ive had my implant almost 3 years now i was on the pill consistently i got pregnant and didnt know it i lost the baby so this was my alternative to use since pills failed me twice my periods have been irregular and lasting longer every other month ive gained some weight with it but ill choose this again just i dont have to bear losing another baby while on the pill and using protection	0	1	0	1
4973	ive been on this pill for about 6 months now the first month i bled almost nonstop and my hair seemed to be falling out a lot more than usual but i stuck with it and now i have no side effects i used to have seven day extremely painful periods but now i bleed for about 4 days per month and it is really light which is wonderful	0	1	0	1
1739	i got skyla put in on december 1st  i dont have children so i was a little nerves about this since they had to open my cervix i got to the appointment and waited about 15 minutes top before called back it didnt take long to get everything started i wasnt on my period because i was coming off the depo which i had been on for 6 years it was the worse pain ive every experienced in my life i got very light headed and thought i was going to pass out the nurse had to bring in paper towels to put over my head i laid there for about 30 minutes before getting up to leave only side affect for me is i cramp really bad for two days after inter course with my husband does this happen to anyone else	0	1	0	1
8316	i started lo loestrin in july and found my self becoming very stressed out and depressed all the time i also felt easily angered so i decided to stop taking it my period pains came back and i decided to retry it in december since then ive gained 5 pounds and bloat super easy even when i only eat small meals i also have been getting strong persistent cramps every night im looking to switch to a different birth control	0	1	0	1
18001	ive been taking trinessa for about 45 months now and it hasnt been too bad its the first birth control ive ever used i never have had bad acne at all but the first month i was on it i had terrible acne but thats normal and now im seeing i get acne more the week before my period on this pill also the first month and a half i noticed i was getting depressed but that went away  ive had a severe decrease in my sex drive to the point where i usually dont even want to masturbate but its kind of coming back 5 months later i havent tested out its effectiveness yet because of my low drive other than the low drive i dont really have any problems with it but if i forget to take it i will get a headache until i take it	0	1	0	1
9749	i started taking microgestin about a year and a half ago ive never taken any birth control before this the first couple months i either missed my period or had little to no bleeding as the months went by my period started to actually feel like a period and what i mean by that is light bleeding but last a few days ive noticed i feel tired and hungry more often then before put on a few pounds breasts felt sore i broke out with horrible acne when i had to double up on the pill 	0	1	0	1
8437	well the first 2 months on microgestin fe 120 my period didnt regulate until the third month i started the 4th month pack amp got my period a week before amp its a super light flow i called my doctor amp they prescribed me a higher dosage 1530 and they said for sure my period should cut off amp regulate but i didnt have any side effects or weight gain or bad acne im going to finish this first pack if i dont like it then ill switch to aviane	0	1	0	1
8457	when first taking this medication i threw up the first few days of taking it through the months i have experienced excruciating pain 26 hours after taking it i normally take it around 11 or 12 right before bed so between 1 and 6 in the morning i am waken up by the pain its an aching pain with nausea it is about once or twice a month but when it occurs it is unbearable it lasts for about an hour or until i can fall asleep in the fetal position the only thing that lessens the pain i am not allergic to anything nor sensitive to foods so i am sure it is not related to consumed foods it does have some positives i  always receive my period on the same day and am not pregnant so it does what it was intended for	0	1	0	1
7294	the first 6 months were amazing no period and only minor cramps when i exercised vigorously then i noticed my hair started thinning out and i was getting really bad acne i finally got it taken out a little after having it for a year and am still having acne problems and my hair still seems to be falling out hopefully it doesnt take long to get back to normal	0	1	0	1
14807	i stop taking this pill after taking it for 4 years i completely stop pms for an entire year so i finally got off because i actually want kids some day and i dont want to become sterile	0	1	0	1
1231	i been on nexplaonon  for a year now an this is worst birthcontrol every my periods last up to 2 weeks an i have bad anxiety attack were it feels like i cant breath or catch my breath  an  never sleepy im always up at night andont go to sleep until the afternoon i getting it remove asap	0	1	0	1
3794	i rated this a 1010 because i was extremely happy with the side effectsresults i was looking for in this pill although this is a birth control pill i was taking it for personal reasons which being i had heard that birth control usually made your breast larger i dont like my natural breast sizebutt size or body weight and the reason i started taking this birth control in the first place was a medical reason but i wanted to continue taking it for the breast enlargementweight gain reason i was taking it for a total of three months i started noticing a change in breast size and weight gainbutt enlargement due to weight gain within about a month or month and a half of taking this birth control it boosted my self confidenceesteem	0	1	0	1
12918	"implanted june 2013 experienced no pain inserting my arm was numb for a few days from lidoderm i spotted for about a month and a half which i expected its been 8 months now and i seriously only bleed once every few months im surprised to see so many reviews of non stop bleeding ive had nothing like that 
my only side effects i notice are acne and night sweats no mood swings or emotional thoughts
love this birth control"	0	1	0	1
12711	my experience during the nexplon is great not a pregnancy yet  my only issue is it causes me too much bleeding i get my periods from every other week up to 1 month up to 3 month  and it ruins my sex life	0	1	0	1
254	at first i loved it im going on year two now but recently i have slipped two months of a period and have fallen into a so far sixteen day light blood with clots period i was diagnosed with extreme anxiety not too long after receiving and i feel like the mood swings and problems brought on from the hormones is causing a problem in my six yr marriage and sex life im 27 with  two boys i shouldnt be feeling this achy and psycho as far as weight gain goesive lost a ton of weight on it 40lbs slow and healthily i feel the weight gain has a lot to do with diet and activity	0	1	0	1
2374	ive spent 11 months on camrese and its been great  no period my acne and mood swings were under control  i had occasional spotting and over the course of the past year ive gained 10 lbs with no other lifestyle changes which are the only reasons i will be discussing changing medication with my doctor	0	1	0	1
15829	i have been taking seasonique for almost three months  i did not have a period until three weeks ago and i have been on my period for 3 weeks  it is very light i have read through the information and it says your period can last for over 20 days  i do have a call into my doctor to see how much longer i need to have my period before i need to be concerned	0	1	0	1
3287	ive taken this bc for 5 years amp absolutely loved it but have noticed that within the past two years ive had no sex drive what so ever amp can not get wet if it wasnt for those side effects i would keep taking it but im changing to a new bc to hopefully fix that	0	1	0	1
1891	it made my breasts huge well a half size or so bigger ill take anything at this point im less crazy hormonally	0	1	0	1
15597	ive been on this pill for about 3 years and recently started experiencing some spotting in between periods even sometimes during sexual activity i went to the doctor and she said this is normal and my body could now be rejecting it she had me stop taking quasense and put me on a one month pill i eventually switched back to quasense two months later and havent had any more issues until recently this month my period was 12 days but ive been cramping like crazy and not bleeding thats why im here on this thread reading about others experiences hope this helps	0	1	0	1
6166	ive been taking till pill for about a year now its been working great so far only problem is the effect it has on my hormones its been making me crazy emotional ive never been an angry person but ever since i started the pill its so hard for me to control my anger	0	1	0	1
7638	"started seasonique about a year and a half ago had some spotting for the fist six months and then it tapered off the first period i had on it was excruciatingly painful felt like i was constantly getting stabbed the first time i felt those cramps i dropped to the floor for a bit i decided to weather it out and continued taking the pill worked great for about a year but then started getting random spotting that lasted for 3 weeks have switched to another bcp now 

as far as i know it worked pretty well at preventing pregnancy i took it around the same time every day i never really missed any days so i cant relay any experiences about that"	0	1	0	1
3147	took it for about nine months and everything went smoothly my heavy horribly painful periods suddenly became lighter shorter less frequent and less painful i even lost about 30 pounds while on the medication id been trying to lose weight for years prior however i stopped taking it for about a month had surgery and had to cease all medications and when i got back on it it was like a completely different drug my period went back to being heavy and my cramps even worse than before but this time it came with intense mood swings im talking screamingcrying one minute laughing the next my advice this is a good medication as long as you continue to take it and dont stop the hormones will mess you up	0	1	0	1
12986	ive had the nexplanon implant for a year now at first it was brilliant had my period and then nothing for a good month after a while i started noticing brown spotting in my underwear not a lot but it was enough to put me off being intimate with my boyfriend i put up with it for 3 months as the nurse said it will take time to get used to in summer i thought it was best to try taking the pill with the nexplanon to help regulate periods this was amazing after id finished the course no bleeding for 3 months but then i bled for 4 weeks and finally it stopped this appears to be not the right birth control for me however its very effective in the sense that im not pregnant please dont let my story scare you away its worth a try 	0	1	0	1
3223	i had a myometomy over 7 years ago i had a relief of not experiencing abdominal pain heavy bleeding blood clots and cramping when having my menstrual cycle fast forward 7 years later i have those same symptomsabdominal pain heavy bleeding blood clots and cramping i knew my fibroids grew back after extensive testing ultrasound it was confirmed by my doctor she said the fibroid was on the outside of my uterine wall and not on the inside she gave me options surgery or birth control i chose birth control and she put me on junel 120 so far very little cramping and no blood clots and abdominal pain mind you i still take ibuprofen but im more physically outgoing and not bed ridden or curled up into a ball	0	1	0	1
265	ive had it for about 3 years now amp it just keeps getting worse i have all the symptoms of having an ovarian cyst in both sides but have gotten xrays amp quotnothing is wrongquot major unbearable cramping to the point where im crying it works very effectively but at a cost my period has never been 10 days long sometimes i get 2 periods a month within 12 days of each other i get pms 12 weeks before my actual period amp constantly discharge im highly considering getting it removed	0	1	0	1
9329	ive been on the depo shot for almost 8 years the first two shots were the toughest to go through but nothing compared to my regular period i bled so badly before depo i was wearing a pad and tampon changing both every hour incapacitated by the painful cramps and back pain mood swings between the 3rd shot and now 7 12 years later no period or mood swings its been amazing the only time i spot is when im getting close to my due date for my next shot so a friendly reminder	0	1	0	1
16927	i started taking sprintec october 2016 this was my first time on birth control so i did not know what to expect the first few months were normal as if i wasnt on anything however i did start gaining weight and my periods started coming later than they were suppose to i started feeling down a lot more often and it totally killed my sex drive which sucks because that is why i started taking it but it did do its job so i cant really complain	0	1	0	1
1233	i have been on beyaz for 4 months now after being diagnosed with polycystic ovary syndrome i have lost 50 lbs in the last 4 months my mood is better my face has cleared up dramatically i would recommend this to anyone	0	1	0	1
17195	i took sprintec for 4 months and it was a fine and dandy birth control for pain with cramps but i couldnt take the cystic acne it brought on i never had acne before the tenderness in the breasts was also quite bothersome other than that good pill but too much acne	0	1	0	1
8229	this was and is still a  nightmare contraceptive  bought this and used with my boyfriend used 3 in one night  we both had side effects  we are exclusive if not i would have thought i caught something  felt good after using but 2 hours later the excess is flowing out amp leaves me feeling slightly irritated  i wash again but still feel a persistent irritation day 2 he had a weird sensation while peeing  both of us have itchy genitals and it only gets worse from there  i almost feel like a yeast infection  my anal region itchesmy vaginal area feels dry but it isnt  its just highly irritated  ive used raw yogurt acidophilus pulls and so feel irritated  never using this again its day 4 and these symptoms are still annoying	0	1	0	1
9183	i just recently got on the shot i had unprotected sex within the third week prior i havent started my period and its scaring me a bit ever since i got on the shot ive realized ive had multiple nose bleeds im not sure if this is from the shot my sex drive hasnt decreased a bit but i seem to be drier than before 	0	1	0	1
7694	the 2nd  3rd week was hell i felt nausea aches cramps and going to classes was a chore for the next 2 12 months i didnt have a menstrual cycle which was worrisome because i didnt know if i had gotten pregnant of not but then it started for three days so my fears lessened another month without a cycle and it came around the same time as it had before no real change in my period besides it lasts a week to a week and a half now and then stops its much more irregular than when i was on the pill but i dont have it as frequently so i dont worry so much about pads or tampons every month im reaching the 9 month mark and now i have an itchy bump form in the area where the implant is for two mornings but they go away after 30m1hr	0	1	0	1
17637	ive been on it now for a month and ive been very moody angry and just wanting to be by myself ive gained 5 extra pounds but as far as acne goes its been clear ive been getting really bad headaches and wanting to throw up after i eat it seems like ive gotten all the side effects	0	1	0	1
17122	due to new insurance i switched form orthocyclen to sprintec in march starting my third pack of sprintec now i noticed a pretty significant change in my moodattitude i have a lack of motivation increased feelings of sadness and my energy level is lower than it ever has been in the first month of taking sprintec i had a breakouts of acne more than i usually had however this seemed to clear up and has not been a problem the last couple weeks im hoping that my body is just getting used to the new pill and that everything will balance out and my mood will return to normal other than that the pill does what it is supposed to	0	1	0	1
1026	so far i havent had any problems with apri at first my feet swelled a little bit and i was kind of bloated but that all went sway after the first pack ive had nexplanon which was the worst birth control i couldve ever got it cause so many health problems for me mostly stomach problems it made me lose a ton of weight which wasnt very healthy for a 15 year old i was on the depo shot and that made my moods crazy i have pretty bad anxiety already and the shot pretty much made it worse i dont take any medications for my anxiety because i dont believe i need to but i had to with the depo shot it made me gain about 15 pounds so im basically back to where i was 3 years ago before nexplanon apri has been the best for me yet	0	1	0	1
3559	ive been on sprintec for three months now it has made me lose my appetite almost completely i find myself eating once a day if that because nothing sounds or looks good i have lost 15 pounds since i started it which is okay unless i keep losing weight i have no mood swings or cramps and my period is predictable and comes on the same day each month however my face broke out insanely the second month and is just now clearing up and i bledspotted for almost a whole month the second month	0	1	0	1
1197	i have been on beyaz for about 3 weeks after switching from yaz due to cost now and i feel more bloated depressed and have experienced weight gain  i have also had headaches  i havent had a real period in several months since yaz would just make me have cramping not actually bleeding i even have taken tests to ensure i wasnt pregnant because i wasnt bleeding im not sure if the same thing works for beyaz or not  i just hope my body adapts to this and i start to lose weight again and get energy back	0	1	0	1
3848	most of these reviews arent so good and most of the reviewers arent giving their body enough time to adjust to the hormones your body is trying to get used to the pill so thats why during the first month you may get some unpleasant side effects like mood swing and acne i had nightmares for the first 3 weeks sore breasts after that and acne breakouts my first period on cryselle was horrible the cramps were awful but everyones different im still going to give my body the opportunity to adjust to cryselle if youre having some unpleasant side effects while on cryselle talk to your doctor especially if its something serious but dont be quick to give up the pill because of things like acne and sore breasts things can improve	0	1	0	1
15687	this birth control is wonderful because i never have cramps i used to have them so bad that i would throw up  i rarely have acne ive never had worse than very mild acne before though  my boobs grew big boobs run in my family  but it gives me constant yeast infectionsi shower daily sometimes twice and wear full coverage underwear and this doesnt make a difference  i will be switching soon no mood swings either	0	1	0	1
10018	i had been on a different bcp for over 20 years and had a generally low libido but pretty much no period with that pill i went off to have a child then retuned to the same pill and became very emotional and depressed with a worse libido my doctor changed me to minastrin and my emotions were much better and libido improved also i do get spotting the week before my period which is non existent however now that ive been on this pill for over a year my weight has increased 14 pounds i am so hungry and my blood sugar doesnt seem to be very steady  i tend to get low blood sugar easily and am not a diabetic  so now im really hungry and can eat as much as my husband and even though im exercising more i continue to gain weight	0	1	0	1
