	review	pred_polarity	test_polarity	false_positives	false_negatives
11070	so i just started this birth control almost 2 weeks ago i am 24 and this is my very first birth control i have ever used i was prescribed this pill to help with pcos symptoms i read reviews before taking my first pill and was super scared i was expecting to feel horrible the first 4 days i felt nothing at all except extreme sleepiness and my appetite has gone down some the 5th day i had a horrible headachedizzinessnausea and i ended up sleeping it off i pushed the time i take the pill to later evening because i have felt so sleepy since starting this medication i dont really see it being listed as a side affect and im not sure if anyone else has the same problem but i am pretty positive its the pill	0	1	0	1
13957	i am very glad to use this birth control because for me there werent any side effects i am very satisfied for this product the pills make me sick and i feel nauseous all the time i have had aches vomiting pains in my abdomen and i was very very dizzy	0	1	0	1
15107	i have been using tri cyclen lo for almost 2 years and i have decided to switch to nordette i like tri cyclen lo for not getting me pregnant but it gave me a few side effects that i didnt want to live with again i had a huge decrease in sex drive i gained 25 lbs in weight i cried a lot for any situation i had mood swings and my period lasted 5 6 days and heavy with pain i think the only good thing is that it cleared acne very well my period came exactly on time and no pregnancies i hope nordette works better for me	0	1	0	1
2456	i had this inserted in october 2013 after consulting with my doctor who pushed it for the convenience insertion was quick and painless with minor stinging the first 2 months were awful with acne depression crying and mood swings which stabilized once i recognized the cause months 4 to 6 were even worse because i would not stop bleeding numerous times i wanted it removed but my doctor told me to give my body 6 months to adjust finally after almost 10 months my body is doing better bleeding has stopped for 6 weeks and counting although i am fighting slight weight gain of 3 to 5 pounds yes you cannot beat the convenience but you need to seriously consider the side effects because they were unbearable many times for me	0	1	0	1
2035	"i had horrible pain for 1 week out of every month and was in and out of the hospital trying to figure out what was causing the pain then my obgyn recommend i get the iud
i am on my second one no more periods and no more pain every month knock on wood"	0	1	0	1
9534	at first i just experienced stomach troubles occasionally with this pill on the plus side it made my period much lighter but it has been inconsistent i usually have a 25day cycle i have been 10 days late and 5 days early on this pill then the 10 pounds came on and quite quickly im 44 and have been the same weight for 20 years so it was upsetting to have clothes suddenly fit very tightly i havent changed my diet or exercise regime so i attribute the gain to this pill i feel bloated most of the time too other than that i didnt experience the other side effects some are experiencing 	0	1	0	1
12281	well when i first got it it didnt hurt at all just feels really weird when i put pressure on it or hit it on something i think i may have gained 10lbs since i got this in july i havent had periods just spotting at random times sex drive was completely nonexistent for a few months but other than that no pregnancies or serious problems i recommend it if you can get by the side effects for a few months	0	1	0	1
13823	i love it not having to take a pill everyday its amazing so far ive been on it for 3 weeks now i havent tried having sex yet because my doctor told me to wait i hated take the pill and yaz and trisprintec made me so depressed moody and i had no sex drive no mood swings yet and i start next week my sex drive is getting better so wish me luck	0	1	0	1
17545	there is not one birth control method you can find that doesnt have complaints  all the complaints are the same too  i have tried nuva ring ortho and the mirena which all of them were a thumbs down for me  i have been on trisprintec for a month now and this is the best fit  ive had no stomach issues and i have a phobia of nausea and vomiting  i have to say my biggest complaint would be the bloating in my stomach  my stomach and my hunger have increased i cant completely say its the pill because ive also quit smoking and ive replaced food for my smoking habit  my acne has been pretty badlike super huge bumps everywhere  my mood is here and there which is sort of normal for me anyway  i like the pill overall though	0	1	0	1
4099	i really really wanted to love the mirena i had inserted on february 14 2011 yes valentines day and finally had it removed today it definitely made my periods lighter but i also had 2 a month every month at 9 days each typically my period is fairly heavy but only 5 days and only once a month that was complaint 1 i was constantly bloated and gained 19 lbs despite working out and dieting my biggest complaint is that i had huge emotionalhoromonal issues with this everything from random crying to just being extremely emotional even depressed at times i am a fairly happy person normally i had the mirena removed and replaced with a paragard i really like the aspects of the iud and not having to worry regularly	0	1	0	1
3482	i have been on this birth control for maybe going on my third month so far i have more positives than negatives i have barely had any acne at all maybe one here and there im not very emotional either before i began taking sprintec i always had horrifying cramps at the beginning of my period each month now i barely have any at all the worst part about this birth control for me is that ive gained 20 pounds and it is noticeable	0	1	0	1
11997	i wouldnt recommend nexplanon to anyone unless you want to gain weight i bleed every other week for about 6 months but then it stopped and i didnt have a cylce for the next 2 in a half years never got pregnant which was the best part about this birth control but my mood swings were horrible and i gained 30 pounds in a 3 yr period i always worked out and ate a good diet but the weight would not get off of me i finally got it removed and ive lost the entire 30 pounds i lost	0	1	0	1
11264	i had the implant for two years the first yr was nice no symptoms or anything second was awful tho my bleeding was 3 weeks long a got awful acne violent cramps and so so so so moody like i literally wanted to kill someone i couldnt take it anymore so u got it out and let me just say getting it put in is much easier than taking it out im now on the pill but thats just my experience it varies for everyone i didnt get pregnant tho hahaha	0	1	0	1
17875	"i was on trinessa for almost 6 months it did its job on birth control my acne was almost gone with this medication and less hormonal during my time of the month worked great for me no abnormal bleeding with this one

the bad effect that happened to me during the 6 month period i had gained 25 pounds i went from 110 to 135lbs i wasnt like a twig i was fit but then after this i got tired and just ate all the time i also would get really nauseous from the first 2 weeks works well but the side effects were bad

everybody is different but this is what happened to me"	0	1	0	1
12333	easiest way to not have babies light bleeding for a month headaches mood swings acne and weight gain after 4 months all clear up except for the waight gain it was only 13 pounds but for my height it was alot no periods for almost 1 year and half after that i had normal to light periods every other month my doctor decided to remove it because i wasnt able to lose those gained pounds  we thought it will be better with something else with less hormones	0	1	0	1
5215	"i loved the implanon for the first year of use  it was easy painless and effective  i barely got a period the entire first year on it awesome it also had no effect on my high blood pressure i would have recommended it to anyone 1010 times 

now that i have had it for a year and a half i change my mind  i have read that it becomes less effective in preventing pms symptoms over time and it has proven to be true

the past 4 months i have been randomly bleeding for days on end multiple times a month painful cramps and intense mood swings i just made an appointment to have it removed 
everyone is different but i would most recommend the implanon for a year of use  definitely worth it for that period of time"	0	1	0	1
26	1st off this is my 4th time with an iud  the 1st paraguard i got while lactating and not having periodsclinician couldnt get iud in and 2nd time trying she forced it in  perforated my uterushad to have 2 surgeries to have it removed  then years later had paraguard againthis time they did a paracervical block and the insertion was painless  my periods were so heavy though and without realizing it i think i became severely anemic  i had it removed and within 2 weeks started to feel alive and normal again  that is when i realized i must have been anemic   years later i had mirena put in due to my long spotting periods  couldnt tolerate the hormones have another paraguay now for 2 years and i  am exhausted all the time	0	1	0	1
3874	i have been taking this for 32 years no pregnancies no problems couldnt recommend it more	0	1	0	1
12564	i got the implant in march 16 so i havent had it all that long yet the day i got it i had my period for two weeks straight and was spotting pretty frequently after that i definitely feel like the implant has changed me i often feel depressed and am extremely moody and i hasnt effected my libido thankfully also i keep having dreams that im either pregnant or have a baby which started after i got the implant i feel so bad for my bf but he knows its the side effects i finally stopped spotting hopefully but other than the mood swings i cant really complain it beats having to take a pill everyday	0	1	0	1
18328	i do belive everybody experiences different symptoms its my third box of yasmin and im probably gona give it one or two more shots but im thinking of quiting it first box of my pills was a 21 day long nightmare  i had breakthrough bleeding whole month i wasnt even sure when my period started i had huge intestinal problems went for two abdominal ultrasounds because of constant bloating overly active guts and diareaconstipation it switched every 2 or 3 days my breasts dear lord i never felt so tender in my entire life luckly as the next box came bleeding stopped so did tendernes i still do feel bloated and gassy but its lot better gonna give it one more shot but i just dont feel its suiting me	0	1	0	1
14316	"im 17 and have been on ocella for about 9 months if not more in terms of effectiveness i cant say i know because i use a condom every time i have sex
however it has done wonders for my acne and i havent had an increase in weight but ive noticed recently that whenever i have my period i end up being in a terrible mood i dont want anyone to talk to me or anything i want to cry im either pissed or i cry
another bad thing i noticed is my sex drive has gone way down im considering changing it but i need the pills for periods as well my periods are very irregular but i want to be on birth control since i am having sex"	0	1	0	1
7275	one week still top notch shape luckily my peripd ended a day earlier thsn my usual 5 day period  of course all medicines require side effectsdont feel extra moody or anything my only concern is dry eyes so far when wearing my contacts which will hopefully will subside before next month where i will be taking my yoga teacher intensive training definitely dramatically proved to subside much of my hormonal imbalance symptoms i am 4quot11 and 100 lbs 28 years old healthy active and finally seeing my acne under control in one week	0	1	0	1
2157	i personally was on aviane for about 8 months the first 3 months were pretty much flawless i had a problem with my appetite to begin with gained some weight and dropped it shortly in the next coming months didnt experience any acne or stomach nausea after three months my period got progressively worse i had intense cramps and felt down right miserable my entire body ached aside from feeling awful i was miserable to be around i had mood swings ive never had before aviane was driving me crazy on my periods i felt like a different person my friends family and boyfriend could even tell i wasnt myself just wanted to put this out there if someone was curious there are other options	0	1	0	1
14278	ive been on the nuvaring for a little over a year and at first i loved it it was my first birth control and i did not think i would remember to take a pill everyday so this seemed perfect and it was it is very effective for not getting pregnant i have been having unprotected sex with my boyfriend since and not once had an issue  the only thing is that it did not help with my cramps and back pain as the months go on the pain gets worse and worse  i also have times of severe mood swings and depression  im switching to seasonale this month to see if it works any better	0	1	0	1
1607	i got my nexplanon 112114 and my nonstop bleeding started january and havent stopped since first it was heavy for one week then light then heavy for two week now its just spotting and i think its about to go off but i can never be surejust ready for it to go off because im tired of buying pads	0	1	0	1
14897	i have been using this pill for almost three months now it has worked great for preventing pregnancy and has made my periods lighter with less cramping at first i was experiencing some abdominal cramping but that went away after a while the only side effect that has caused me problems is it made me very emotional i get depressed easily but not on a daily basis usually every one to two weeks i go through a phase where i cry a lot and think about things from my past that upset me judging from what i have read the emotional side effects go away after a while so i want to keep taking it and i would recommend it for anyone	0	1	0	1
7842	"why i am taking this mediciine hormone regulation painful periods painful ovulation i do have fibroids but i will consider removing them if they are still a problem after menopause  i am 45 years old single mother work full time eat healthy workout 3 to 4 days a week  no weight gain or sore breasts i have been reading about on here 


pros i think this bc is great pain is gone periods are lighter i have used the patch and other pills before


cons  i had some slight nausea take this with food at breakfast or lunch and take it within a consistent time of day everyday  be sure to drink your water all day and eat healthy wellbalanced meals

did it work for me  yes i do not have pain anymore periods very light"	0	1	0	1
7427	ive had the iud for about 5 months for the first month i bled constantly with heavy clots terrible cramps and tender breasts things started to improve around the second month with only light bleeding and now i have random spotting or a period that lasts a few days i initially had acne but read about black african soap which in conjunction with tea tree oil after showering has eliminated it i have pcos and already had hair growth on my chin its a lot worse with the iud in place and im going to electrolysis to eliminate it that is my biggest complaint no weight gain but i did experience bloating and ive always gained on bc westrogen once my husband felt it but my doc snipped the strings and its not been a problem since	0	1	0	1
14117	the nuvaring has been ok for me with the exception of making me feel like i have an uti on and off it has dramatically increased vaginal discharged and causes some itchiness i think this is what leads to the bladder irritation that feels like a uti ive also gotten some headaches and noticed some bloating around my abdomen all in all i am probably going off of the ring im scared of any birth control at this point they all have side effects	0	1	0	1
3885	had this for 1 year amp 1 month to be exact first 5 months were horrible irregular periods amp i always felt like i was pregnant but as months went past my periods became regular again amp i always forget i have it in my arm very effective really does prevent pregnancy my only concern is when its time to come out ive seen too many videos where it was hard for it to come out	0	1	0	1
3185	i have been using xulane for about 2 to 3 months maybe longer i have not gotten pregnant though my boyfriend is fixed next went back into get checked so there is a slim chance i used the nuva ring before i liked it to a point uncomfortable to me and my boyfriend so i switched to the patch at first it was fine then after a month or less of using it i noticed intense mood swings like bi polar mood swings wanting go off on people for stupid little things being straight up mean to my man and not caring then feel terrible after i have no energy at all always tired i hate myself like this its not me im going to stop this birth control i hate these bad mood swings	0	1	0	1
8497	im into my second pack and am not pregnant which is good but im very nauseous queasy dizzy and lightheaded  also im experiencing anxiety and nervousness  i think if these symptoms continue after pack 3 ill need to switch	0	1	0	1
7126	my period would come and a week later it would happen again for two weeks i have been on mononessa for a week and my period is finally under control after years of misery	0	1	0	1
11860	i would try anything i had grown up with the most painful periods every start of my period had me laying on the bathroom floor crying and vomiting it was terrible and not a way to live i went to my doctor and asked for help she suggested this told me some women had bad experiences but i didnt care ladies listen to me very carefully the first couple months are going to be terrible because your body is not used to the lack of hormones missing from your everyday life so yes my ache was terrible i gained weight because i would get the shakes if i didnt eat i didnt have any energy and i was so moody like to the point i thought i would have a nervous break down i spotted for two weeks at a time but now i have no periods and im normal	0	1	0	1
1668	"i used aubra for two functions as a contraceptive and as a way to reduce acne i would call it a positive experience since its main function was to reduce risk of pregnancy and i did not become pregnant while using it 
however there are side effects as with any oral contraceptive different pills use different kinds of synthetic hormones each of which may or may not have a different effect on the users skin
aubra is partly comprised of levonorgestrel which is one of the most androgenic acne causing synthetic hormones used in oral contraceptives 
i have been continually breaking out in cystic acne since i started aubra half a year ago i am currently in the process of switching to ortho tricyclen lower androgenicity"	0	1	0	1
4213	"i started paragard about three months after giving birth to my second child  i had it removed 14 months later  pros 1 i didnt have to remember to take it  2 didnt change my mood or weight 3 comforting that there werent any unnecessary hormones in my body 4 it was effective in preventing pregnancy  cons 1 my periods lasted for three weeks on average sometimes a little less sometimes a little more  i was told it will get back to normal give it a few months after it didnt they refused to believe it was the iud because it was coppernonhormonal  2 less sex with my husband because of the heaviness and length of my periods
  i had it removed and my periods were almost instantly back to normal 35 days"	0	1	0	1
6820	ive been taking this about 6 months  coming off my paraguard implant which i hated copper does not belong in the uterus  the first month i started on  sprintec i ended up with a yeast infection im assuming the extra amount of estrogen caused this an body had to get use to it lasted maybe 4 an half days it did regulate my period to when i started the white pills now this is my 6 month and im started to have two periods a month heavy bleeding too although effective not sure why im having heavy periods so often now another side affect it has made me loose about 20 pounds  over this course of time i become super tired allll the time  it works but i guess gotta get use to it	0	1	0	1
7841	the worse bc ever yes its effective but sense ive had enough of it ive had headaches body aches and serious weight gain was always 160 now im 217 finally getting it taken out after research and reading other reviews also cramping in between periods spotting and heavy periods  worst bc ever 	0	1	0	1
3901	ive had this birth control for about two years now the first year i had it it was perfect it was like it wasnt even there i didnt have periods for a year i lost access weight my metabolism sped up and i had more energy than normal then the december of that year i took an antibiotic for either a sinus infection or strep i forget which one and immediately things went downhill a got a cyst in my ovaries and this was extremely painful then i had crazy nonstop painful periods that would go on for months my obgyn prescribed me with estrogen and that didnt help i now have gained about twenty pounds and i have cellulite everywhere i think ill be getting it out and going solo for awhile to resuscitate my hormones	0	1	0	1
5802	"ive been on safyral since jan 2011 almost a year it was awesome at first but as time went on it slowly started to change me great if you dont have a boyfriend i say that because i have zero want or desire to be cuddly or intimate with my amazing sweet and down near perfect boyfriend of two years 

its the most frustrating of all my symptoms next are the mood swings angry one minute sad the next anxiousit never ends before this pill i always considered myself to be a quotguyquot when it came to emotions i was always just happy go lucky not with this 
emotionsscale of 1 on this stuff
pros100 clear skin all the time no weight gain
its not the worst birth control out there but just be prepared to ride a emotional roller coaster"	0	1	0	1
3222	i am 24 and recently sought out a birth control pill because i will be getting married in march i was put on loestrin24 back in december 09 thankfully i did not read all of the scary internet blogs until afterwards or i probably wouldnt have tried it i have not had mood swings in fact i feel i am a less moodier person now it is easy to keep up with and seeing that i am a first time bc user fell in love with knowing when my menstrual cycle would occur the only negative side effects that have occurred since taking the pill i gained 10 pounds the first two weeks of taking this pill ive had a hard time shedding those pounds but at least it has not increased as of yet secondly my boobs hurt like crazy i can hardly touch them they are so sore	0	1	0	1
4783	i am almost done with the first pack i am on the brown pills and can honestly say i am not sure if i am even going to wait to see if it helps my cramps which is the whole reason i got on birth control in the first place i gained 5 pounds in 3 weeks by doing nothing differently my waist has completely changed i gained fat on my love handles and i have not been eating or exercising any differently i went from 116lbs to 121lbs i have never hit over 120lbs in my life i was 121lbs waking up so its not like i was full from food or something also my breasts are really sensitive the upside to this birth control is that the pills are chewable also i tried aviane in the past and all i could do was vomit the first day i took it no nausea with this	0	1	0	1
8488	when i saw this website and read multiple experiences i saw that i was and am not alone i have a wonderful boyfriend who is still putting up with me and my godawful self for a few months although i have only been on trisprintec for a week it is one of the hardest weeks of my life i feel like i have every side effect for example i am constantly nauseated and always have a headache and in addition i literally cry for no reason my hair is shedding more than it ever has before and my outlook on life has changed from optimistic to pessimistic 	0	1	0	1
11091	within few days of taking the pill my acne cleared up  on the other hand i have gained 4 pounds out of nowhere  feel bloated nauseated  is a shame that side effects are so undesirable since it does work for my acne	0	1	0	1
1224	i at 53 i took heather for birth control for the last 3 12 yrs my doctor decided that i should not be on the pill anymore and i needed to stop taking them during the time i was on the pill i never had a period i loved it no weight gain no side effects since i have been off of them i still have no period my doctor said i probably will have gone through menopause and never had the symptoms	0	1	0	1
2805	after significant weight gain on depo and the implant i told my doctor how im sensitive to hormones more specifically  progesterone so this pill is considered low dose and is a mixture of progesterone and estrogen i decided tried it love the perks of clear skin and 15 pounds down in 5 months cons nausea after placebo week dark inner thighs mild depression and random head aches although i cant say there is a direct correlation between depression head aches and the pill open to try extra low dose and see how it works for me positives out weight negatives at this point	0	1	0	1
