	review	pred_polarity	test_polarity	false_positives	false_negatives
2819	i am 21 years old i was first put on microgestion at the age of 15 my freshmen year of high school because my anxiety was so bad when i graduated high school 4 years later i tried another pill made me gain weight nuva ring made me nauseous every single day for 3 months then another pill then i figured id just go for the iud worst decision i ever made getting it inserted was the most painful thing ive ever experienced and for 3 days after i literally had quotlabor painsquot i stayed with it for 6 months and completely lost my sex drive and when i got it removed i had my period for 3 weeks i went back to microgestion last week and its the best decision for me and ive never had a single problem or scare i love it	0	1	0	1
17381	ive been taking this birth control to help with ovarian cysts it has helped  but im am experiencing bad stomach issues such as nausea stomach pain and throwing up does it ever end ugh 	0	1	0	1
2239	i had no complications with this birth control other than minor nausea in the mornings if i missed one and took it too close to another one in the same day i would be throwing up i probably needed a lower dosage i did quit for other personal reasons about 2 months ago and have had anxiety ive been fearful scared depressed and feeling really weird and its not me i feel i cant control it and really believe it to be the birth control since my hormones are unbalanced now ive read from other woman that it gets better after a few months and i so hope that is true im debating if i want to go back on it to regulate my hormones and period because since its been some time i dont want to get sick	0	1	0	1
890	i absolutely hate this thing i got it implanted at the end of december thinking it would be a great alternative to the pill after the first month of january it has prevent pregnancy but  ive had  a period everyday since january 28 ive also experienced severe depression and mood swings i will be getting this thing out asap i feel like my mood changes are on a downward spiral	0	1	0	1
1692	i got nexplanon on jan 8 2015 and at first i thought it was great didnt have a period the first month next month bleed for two weeks no cramps or anything when march came my period came on and lasted longer than usual so i thought ok maybe its changing because the symptoms are irregular well its may 8 and my period has been on nonstop my body aches muscles hurt everywhere acne is a little more than before cravings are crazy but i have no weight gain or weight loss thank the lord but nexplanon acts different in anyone who gets it i do consider getting it though if you forget to take your pills and if your sexually active	0	1	0	1
13637	"i had been on the combined oral pill for many years and had tried many different kinds i have experience every kind of mood swing possible severe cramping and abdominal pain headaches nausea heartburn moodiness and had severe irritability and uncontrollable bursts of tears before and during my period as well as a decrease in libido i felt out of control
i went to the doctor she told me i was experiencing pmdd which is much worse than pms she put me on norabe since it only has a synthetic progesterone and no synthetic estrogen which apparently increase all of the craziness
only taken for short time but better already i have more control of my emotions and my libido is back in overdrive breast are tender though"	0	1	0	1
13553	"i have been taking norabe for a year now and have noticed the following side effects
1 i never knew when i will have my period on this birth control it seems to be every 3 months 
2 i have gained about 10 pounds even though i have maintained my normal level of physical activity and diet before starting bc i have maintained the same weight for a number of years and so the weight gain is not welcome
3 i have experienced minor vision problems mostly my eye sight is blurry and sometimes i have difficulty focusing 
4 my breasts have increased in size probably due to the weight gain though i can not really complain about the larger breasts they are fairly tender sometimes uncomfortably so"	0	1	0	1
5889	ive been on the ring for almost two years and i am ready to switch it works great for the whole quotnot getting pregnantquot thing but my acne is the worst its ever been and my migraines are hell theyre predictable at least ive been getting them due to estrogen withdrawal so they occur within days recently only 1 day after i take the ring out and last 3 days but theyve been getting worse and worse every single month i cant do this anymore anything is better than waking up hourly to dry heave while in severe pain my most recent and worst episode to date i do recommend it but not for longer than a year	0	1	0	1
13972	ive been on the nuva ring for about 3 years now i have had no problems except i literally have no sex drive anymore which really sucks i constantly feel bad for my boyfriend of 4 years because i just have no desire for it at all which makes sex painful because i am not wet enough this is unfortunate because i love every thing about the nuva ring besides that one issue however i am still probably going to switch to something else because that is a big factor for me	0	1	0	1
13297	i started the nexplanon november of 2013 from there my period was crazy and out of control i started getting acne and my sex drive was down to the ground i havent had sexual intercourse in months because of the prolong period and no sex drive other than that i love that you dont have to worry about taking it everyday and that i didnt gain weight i had to get it taken out after 6 months which is today couldnt take it anymore	0	1	0	1
15730	im 29 and have been on safyral for 3 months now for irregular bleeding i have breast tenderness bad cramps acne and i am also very moody my anxiety level has raised a little and the bleeding is heavier than normal this is also my first time ever taking the pill this is my last pack im taking	0	1	0	1
6615	ive written a review 2 months ago and things have changed a little im 18 years old and ive been on this bc for almost 4 months the first and second month and a half i was experiencing bloating nausea and pelvic cramps i also felt a little depressed and down i spotted in the third week of the pack and got my period on the placebo week in my third pack i spotted and only had my period for about 3 days when i normally have it for 5 i also had a yeast infection and a uti 2 weeks later now im on my third week of my fourth pack and ive been experiencing pelvic cramps for a week i havent spotted yet  my nipples started to feel sore too which was strange because it never happened since i started takin the birth control	0	1	0	1
8255	i was on lo loestrin fe for 4 months during that time my hair started falling off dramaticallyi didnt get pregnant so it served its purpose but i had to stop taking it because i was literally going bald i noticed hair loss is not noted as a side effect but its been 1 month since i stopped taking lo loestrin fe and my hair has been growing back and it hasnt been falling off anymore	0	1	0	1
17553	good for preventing pregnancy and clearing up skin but it does make some women gain water weight i gained 20 lbs on it and rapidly lost it in a month when i switched to another brand so make sure you notice how it affects your body while on it to me the weight gain was not worth it	0	1	0	1
4511	i took sprintec for 4 months and it was a fine and dandy birth control for pain with cramps but i couldnt take the cystic acne it brought on i never had acne before the tenderness in the breasts was also quite bothersome other than that good pill but too much acne	0	1	0	1
1668	"i got nexplanon in 1114 its been a few months amp it works great no pregnancy scares amp no loss of sex drive unfortunately side effects are heavily weighing on me i have been so depressed ever since i got it i dont feel like doing anything but cry i have intense mood swings where within 5 minutes ill change from excited to hating everything for no reason its even taking a toll on my relationship im thinking a about removing it in a few months if my mental state isnt better if you are already depressed do not get it
ps lots of breakouts to be had amp depigmentation on skin"	0	1	0	1
1857	i got the nexplanon in march of 2015 so far its been good never had any problem bleeding wise but i have developed severe anxiety and depression and im always tired but when i close my eyes my anxiety kicks in and i cant sleep and ive had horrible mood swings the littlest things set me off	0	1	0	1
3851	i love apri i tried another birth control and it made me so depressed but on apri i feel just fine the only problem is that in 18 months on the pill i have gained about 20 pounds with very little change in my diet and exercise it is so hard to lose weight on apri	0	1	0	1
12793	i got the implant put in the beginning of february this year 2015 i am 18 years old weighed approx 125 before and after almost four months later height is 53 and before i had the implant i was on a birth control they set me up with that was supposed to be closest to the hormones in nexplanon only an oral version that was the worst three months of birth control ever heavy period every other week morning sickness constant tricking of my bodys senses with this implant life has been great period stopped that month and have only spotted once just recently mood swings are minimal if not nonexistent feel more laid back than usual and have an appetite for food and my boyfriend which is more than i could ask for  recommend 	0	1	0	1
1664	i have endometriosis and was put on camrese so i could have less periods and hopefully lessen the severity of cramps and pain  the 1st 6 months were rough with spotting almost every other week and a 2 week long period weeks 89 but once i started the 3rd pack symptoms resided and improved  however in january insurance decided to switch me from camrese to amethia  i have since gained 20 pounds and am very moody  my acne has stayed fairly clear though and cramps and pain are still managed better than they were with onemonth bc pills	0	1	0	1
10244	i used mirena for 8 months it worked well as birth control but caused me to have 2 week periods and also some minor hair loss and bloating i liked not having to remember taking a pill but couldnt tolerate the very long periods my advice is just give it the 6 months to regulate like your doctor says and see how it goes for you	0	1	0	1
3753	after i noticed my levora birth control was no longer helping my face stay clear of pmsrelated acne among other symptoms i asked my doctor to switch me to a new birth control she gave me ortho tricyclen lo i just started my second month on february 21st during the week of my period my period came as a surprise because i had absolutely no pms symptoms no breaking out no migraines and no cramps i have not experienced any side effects with this birth control either my doctor made an excellent choice for me i hope my second month will be just as successful	0	1	0	1
12831	i was put on nexplanon in may of 2015 iv had it for almost a year let me say im so ready to get it taken out iv gained weight i have really bad mood swings i have bad cramps in my stomach i have cravings my breast enlarged big time and it makes my arm hurt i cant even use my arm for long time and its killing me i cant even bench or do push ups and my arm hurts sometimes it aggravates me and feels like its poking me ive had nothing but trouble since ive got this thing	0	1	0	1
1729	trivora was very effective in preventing pregnancy however almost immediately after i began pack 1 i experienced yeast infections due to the high levels of hormones the symptoms went away once i took some over the counter creams im currently on the end of pack 3 and im getting off of this pill because ive experienced bloating stomach cramps and really really bad gas ive never had a gas problem until i began trivora so this gas cramping occurs during random times daily and its a problem so i cant wait to try something different	0	1	0	1
8512	while it does prevent pregnancy it has many negative side effects i experienced weight gain weight that wont go away no matter how much exercise i do frequent acne break outs and negative mood however it does what its supposed to do and keeps my period very regular i plan on continuing my use of chatel just because its my only option and it was free from planned parenthood	0	1	0	1
1644	before taking aubra my doctor had me on gildess fe 120 and that was probably the worst pill i could have ever taken at first gildess cleared my acne but it gave me severe mood swings along with constant headaches i also had some spotting in between periods and i gained some weight as well after the 2nd month my acne got worse and that was the last straw for me to go and switch pills ive been taking aubra for about a little over a month and i absolutely love it the constant headaches are gone my period lasts about 4 days no mood swings whatsoever and my acne is fairly mild plus in addition to all that i havent gained weight since ive been on it	0	1	0	1
15736	my experience with safyral had been an overall good one but it didnt start out that way  during the first month all through the second month i had horrible mood swings borderline depression it felt like  but after the second month it went away i started feeling better ive had no acne no weight gain lighter flows so i guess this pill is different for everyone based on the other reviews but this is a great one for me and i plan to keep using it for a long time	0	1	0	1
319	been on this birth control for 3 weeks and ive had acne on my chin like i havent had in years and i am constantly starving to the point of sickness as well as extremely fatigued this is terrible going to give it another month to see if it levels out but i highly doubt it will	0	1	0	1
2156	i had my implant for two years just had it removed couldnt take it anymore it made me feel awful i constantly was buying tampons liners and pads all i done was bleed i felt bloated all the time and stayed tired all i wanted to do is sleep also was not sexually active at all also horrible back pain and gained almost 40 pounds but since i had it removed within a week and a half lost 8 pounds and feel way better not tired at all and sexually active again i wouldnt recommend this for anyone	0	1	0	1
18345	ive been on this for almost two months now and in my short experience it has done wonders  my old periods would cause severe cramps nausea vomiting periods lasting up to 16 days and horrible mood swings  for roughly the two weeks around my period i was so sad and honestly thought there was something wrong with me  but now my periods so far are short almost painless and no vomiting  my mood swings have toned down so much i forgot what it was like to be this calm  the only issue i find is i have gained fat but not weight as ive eaten more so that really is my own fault  and i have very tender dense sore breasts that i cant sleep on my stomach anymore  but this definitely isnt as bad as how i used to be so very good	0	1	0	1
10354	"i had horrible pain for 1 week out of every month and was in and out of the hospital trying to figure out what was causing the pain then my obgyn recommend i get the iud
i am on my second one no more periods and no more pain every month knock on wood"	0	1	0	1
14927	i went on for acne and im not really sure if it ultimately helped with that since i began accutane a few months later however i didnt notice any changes in my mood weight gain cramping i had irregular periods before so it was nice to finally have them on a schedule on ortho tricyclen lo my periods lasted for approximately 6 days but after the first 23 days it was light i ultimately decided to stop because i think it may be affecting my sex life 	0	1	0	1
169	after significant weight gain on depo and the implant i told my doctor how im sensitive to hormones more specifically  progesterone so this pill is considered low dose and is a mixture of progesterone and estrogen i decided tried it love the perks of clear skin and 15 pounds down in 5 months cons nausea after placebo week dark inner thighs mild depression and random head aches although i cant say there is a direct correlation between depression head aches and the pill open to try extra low dose and see how it works for me positives out weight negatives at this point	0	1	0	1
2848	ive been on this pill almost 8 months and i have to say i also have mixed reviews i havent gotten pregnant so it has proven effective in that sense ive also gained weight experienced the migraines and nausea others have mentioned now have lighter periods and get frequent bacterial vaginosis it is definitely as bad as it sounds ive also had some trouble with moisture down there during sex being that my cycle was irregular before i wanted something to prevent pregnancy but also allows for a monthly menstrual cycle this was more than i bargained for i think im going to stop taking the pill and look into other options 	0	1	0	1
3459	i have had this in for about 25 years it works in that i have not gotten pregnant  i have a very light period for 12 weeks every month or so  sometimes 6 weeks in between periods  sometimes only 2 weeks its very unpredictable can ruin a lot of underclothes also i cannot get back to my prebirth control weight i used to weigh an athletic 145 with a diet of whatever i felt like eating and exercise 4 days a week  maybe its age but now 25 years later i can exercise 6 days a week for  twice as long and watch what i eat and am stuck at 154	0	1	0	1
11096	i agree with rebecca so far no pregnancy and i hope it continues but i have been on the pill for 10 months and my period is still messed up ive been on it for over a week now itll come a week early then a couple days later i was really moody but its gotten better i was going to switch birth control methods but am very relieved that someone else is having the same problem	0	1	0	1
11798	i had this birth control for about a year now at first i didnt have my period for 6 months now i have bleeding almost everyday my period last up to 2 weeks i gained a lot of weight and i cant seem to lose it no matter how hard i try i love that this birth control is good and it works but there is a lot of bad in it it causes mood swings a lot of bleeding i just dont know if this is for me i had the iud before this that was a nightmare now i just gotta see what other birth control i could try that wont be making it take a pill everyday	0	1	0	1
11994	i got my nexplanon in march of 2014 so ive had it a year now and i bled for about 3 weeks but it was light and i have an actual period sometimes i like it for the most part mine still hurts and tingles sometimes but its all good	0	1	0	1
10001	i started my very 1st birth control after i had my daughter my dr had perscribed minastrin 24 fe to me and it worked amazingly at first i hated chewing it but im used to it now 4 months in my periods are only 46 days and are very light i am so happy with this borth control and wouldnt even think about switching it out you ladies need to get past the 1st three months and youll be good to go	0	1	0	1
3820	was on it for about a year and 2 months experienced no weight gain or mood swings my acne was not severe by any means but it did flare the first month i started taking lowogestrel which went away the next month still get occasional pimples closer to my period had to switch because after about 1112 months i started spotting during the active pills which turned into full blown periods that would last for 2 weeks tried to ride it out because my doctor suggested it might be a hiccup but it continued for two more months was bummed because i loved this birth control	0	1	0	1
14002	ive been on the ring for 6 months before that i was on the quotortho tri cyclen loquot pills for almost a year for the first 4 months i was raving about it to everyone who brought up birth control be it customers friends family etc things have changed since my sex drive is low im an emotional trainwreck for no reason its nice not having to worry about it everyday and its been great at preventing pregnancy now its harder to just put those negative things aside when i feel like its affecting my relationship and myself emotionally but im still deciding whether to stop using it because i dont want to just use condoms now since im not open to taking any other hormonal birth control at this moment	0	1	0	1
2705	i have been on nexplanon for about a year now at the very beginning i had huge food cravings i did not have a period for about 2 months then for about a month it started to regulate but it was very heavy it has been 5 months now and my period has not stopped ive also gained weight even though im incredibly active i went from 135 to 148 now my mood swings are insane i have severe anxiety and depression overall nexplanon is doing its job and i am definitely not pregnant but there are huge side effects of using this implant i do not recommend it	0	1	0	1
1311	took demulen 135 brand only from 19992007 its been all downhill from there trying to find something that was amazing as this was fuller breast great skin no more cramps period perfectly on time to the hour no headaches amp never once had a migraine in all those years amazing pill brand name now its discontinued amp generic is a complete nightmare kelnor gave me every extreme symptom there was amp felt terrible gained migraines cramps amp zovia made me have horrid cramps heavy flow amp felt terrible i stuck it out for months to no avail i will forever miss demulen 135 brand good luck to you all	0	1	0	1
17335	ive been on the same bc for 4 yrs i had break through bleeding amp my dr switched me to taytulla she gave me 3 month supply im pretty sure dr are being paid to give out samples went to pharmacy to get the prescription and its 500month forget that so im trying the 3 samples to see if i like it enough to get the generic ive only done a month amp ive had bad mood swings bad headaches bad body acne ive never had before super tender breasts and vaginal discharge every day i know when start bc you get symptoms but i didnt expect this from going from one bc to another  ill take a pregnancy test in a week to make sure im not pregnant and give it another month to see of any of this goes away but so far do not take taytulla	0	1	0	1
2752	this is my second time around on this i took it about 3 yrs ago for a full year and totally loved it hence why i got back on it this time it was a much different experience the 3 months i was on it was constant breakthrough bleeding pretty much every single day about 810lbs weight gain fairly active in my late 20s eat clean sex drive was non existent no acne thankfully i also experienced some depression never suicide but just down and blue most days i am switching to microgestin fe 120 because ob said lo loestrin may have been too low of a dosage for me	0	1	0	1
598	for the most part i liked the mirena the only problem i had with it that i see no one mentioning is that i had heavy discharge to the point of having to wear a pantiliner everyday or it looked like i wet myself on the pill now and the discharge is normal again	0	1	0	1
4097	i got mine february 2015 procedure was easy even though they had to put it in twice because the 1st time it was sticking out my arm havent got pregnant but my periods are crazy out of control i stay on more than im off which is very annoying then i will stop bleeding for a day or two and than start again and it will last for a good 3 weeks just this last month i was on for 18 days came off on a monday i was back on on sunday remind you i was on my  period for 18 days its so stressful but i trying to wait my year just to see if anything changes like the dr said but im ready to take it out	0	1	0	1
7335	i have been taking levora for a year now and its been working great i have been with the same guy for a year and we do try and use protection and i havent gotten pregnant i have had some side effects when i first started using it i always wanted to eat my acne was terrible and i was always crying the crying was from my face breaking out so badly after like 4 or 5 months into the pill my acne cleared up and the cravings went away my face has been clear ever since	0	1	0	1
6289	ive been on jolessa since i was 17 and im now 23 amp i absolutely love it i had break through bleeding the first month but after that only four periods a year and they only last 2 days 3 at the most i recently changed doctors amp got camrese and i hate it ive been spotting the whole first month at the end of the month i had a full five day period im switching back to jolessa i thought that jolessa and camrese was the same but they are not	0	1	0	1
12247	"i got the nexplanon implant june of 2015 around november of 2015 i began having a period before getting nexplanon i was getting depo shots for 5 years and had no period at all it was great my period in november lasted about three weeks december it was like two weeks januarymay it was light spotting 1015 days this entire month of june i have been spotting 30 days it is just enough to be annoying because i have to worry about it constantly i work full time and i find i am going to the bathroom 45 times a day just to check

it is nice not having to worry about taking a pill everyday or going to the doctor every three months my doctor told me i wouldnt have a period since i wasnt with depo but apparently thats not tru"	0	1	0	1
